Titre,Auteur,Paroles
a nos souvenirs,trois cafés gourmands,"comment puis-je oublier ce coin de paradis ce petit bout de terre où vit encore mon père ? comment pourrais-je faire pour me séparer elle ? oublier on est frère belle corrèze charnelle oublier ce matin que tu es parisien que as de eau dans vin que tu es parti loin ce était pas ma faute on joue des fausses notes on se trompe de chemin et on a du chagrin on se joue tout un drame on a des vagues à âme tu as du mal au cœur tu as peur du bonheur  acheter des tableaux et des vaches en photo est tout que as trouvé pour te la rappeler vous trouvez un peu con aimez pas ma chanson vous me croyez bizarre un peu patriotard le fruit ma réflexion ne touchera personne si vos pas ne résonnent jamais dans ma région est pire une religion au-delà une confession je aime à en mourir pour le meilleur et pour le pire et si je monte au ciel il y aura peut-être joel guillaume et jeremy et mon cousin piedri yoan ra en voyage dans un autre pays allez, fais tes bagages viens rejoindre tes amis !  on veut du claudie musette à en perdre la tête on veut un dernier chabrol un petit coup de niole les yeux de nos grands-mères la voix de nos grands-pères odeur de cette terre vue sur les monédières est pire un testament au-delà une confidence on est des tits enfants de ce joli coin de france enterrez nous vivants ""bayonnez"" il le faut mais prenez soin avant de remplir notre jabot la relève est pour toi notre petit lucas on laisse en héritage la piste nous on dégage le temps nous a gâté on en a bien profité on a des souvenirs en tête ce soir, faisons la fête !  acceptez ma rengaine elle veut juste te dire ""je aime"" soyez sûrs, en suis fier ai la corrèze en cathéter être avec vous ce soir ai le cœur qui pétille mimi, sers-nous à boire on a les yeux qui brillent...  acceptez ma rengaine elle veut juste te dire ""je aime"" soyez sûrs, en suis fier ai la corrèze en cathéter être avec vous ce soir ai le cœur qui pétille mimi, sers-nous à boire on a les yeux qui brillent..."
quand la ville dort,niagara,"un peu plus tard après la nuit et je n´ai pas encore dormi un peu plus tard après la fin de l´aurore mais est-ce que je t´aime encore. et pourquoi je l´ignore mes larmes s´évaporent et le silence est d´or. quand la ville dort je laisse aller le sort je n´ai aucun, je n´ai aucun, je n´ai aucun remords  mais si le ciel ne me tombe pas sur la tête si la lune a comme un air de fête si la neige ne fond pas au printemps alors j´aurais peut-être le temps.  j´ai oublié ce que j´ai fait la veille mais c´était sûrement des merveilles et quand la ville brûle sous les feux du soleil j´attends alors que tu t´éveilles. la nuit porte conseil je ne suis pas de celles que tu en que tu ensorcelles je me rebelle et si tu me décèles je me ferai, je me ferai, je me ferai la belle  mais si le ciel ne me tombe pas sur la tête si la lune a comme un air de fête si la neige ne fond pas au printemps alors j´aurais peut-être le temps.  et pourquoi, je l´ignore mes larmes s´évaporent et le silence, le silence est d´or quand la ville dort je laisse aller le sort je n´ai aucun, je n´ai aucun remords."
les gens qu'on aime,patrick fiori,"aurais pu traîner le long de mes rêves aurais pu air de rien attendre ici que la journée achève sortir le chien, si en avais un  aurais pu inventer des inventaires refaire et faire le point mais ce matin ai bien plus cher à faire bamdabadabam  ce matin, irai dire aux gens que aime oh juste merci être ce ils sont ils changent mes heures amères en poèmes et tous ces mots que nous taisons  ce matin, irai dire aux gens que aime oh! comme ils comptent pour moi chaque instant deux mots doux est mieux un beau requiem et les dire est important et dire avant, tant il est temps  on veut toujours attendre la prochaine remettre au lendemain est bien plus simple émettre des haines bien anonyme, tapis dans son coin et coulent nos vies et eau des fontaines avide quotidien et passent les jours et puis les semaines bamdabadabam  ce matin irai dire aux gens que aime oh juste merci être ce ils sont ils changent mes heures amères en poèmes et tous les mots que nous cachons  ce matin irai dire aux gens que aime ô comme ils comptent pour moi chaque instant deux mots doux est mieux un grand chrysanthème et le dire est important le rappeler de temps en temps  aurais pu traîner le long de mes rêves aurais pu air de rien attendre ici que la journée achève bamdabadabam  on devrait dire aux gens quand on les aime trouver les phrases, trouver le temps ils changent nos heures amères en poèmes on devrait tout se dire avant  il faut le dire aux gens quand on les aime comme ils comptent pour nous chaque instant les mots doux est mieux un beau requiem et tant on est là, bien vivant tout se dire tant il est temps"
la lettre,renan luce,"ai reçu une lettre il y a un mois peut-être arrivée par erreur maladresse de facteur aspergée de parfum rouge à lèvres carmin aurais dû cette lettre ne pas ouvrir peut-être mais moi je suis un homme qui aime bien ce genre de jeu (je) veux bien elle me nomme alphonse ou fred, est comme elle veut des jolies marguerites sur le haut de ses « i » des courbes manuscrites comme dans les abbayes quelques fautes orthographe une légère dyslexie et en guise de paraphe « ta petite blonde sexy » et moi je suis un homme qui aime bien ce genre de jeu (je) aime pas les nonnes et en suis tombé amoureux  elle écrit que dimanche elle ra sur la falaise où ai prise par les hanches et que dans hypothèse où aurais pas le tact assumer mes ébats elle choisira impact 30 mètres plus bas et moi je suis un homme qui aime bien ce genre enjeu (je) veux pas elle assomme car en suis tombé amoureux grâce au cachet la poste une ville sur la manche étais à avant-poste au matin du dimanche endroit était désert il faudra être patient des blondes suicidaires il y en a pas cent et moi je suis un homme qui aime bien ce genre enjeu (je) veux battre newton car je suis tombé amoureux  elle surplombait la manche quand je ai reconnue ai saisi par la manche ma petite ingénue qui ne était pas tant au regard du profil un petit habitant lui sait sous le nombril et moi je suis un homme qui aime bien ce genre enjeu (je) veux bien il me nomme papa - il le veut"
raise me up (je respire encore),corson,"encore je tombe la chute est longue je dors éveillé des lumières sombres eclairent les ombres des rêves oubliés  au loin tu m’appelles les mots se répètent lentement la voix des sirènes m’attire et m’entraîne vers le fond  come raise me up wake me up take me to the light raise me up come raise me up wake me up take me to the light raise me up wake me up wake me up  encore je plonge ta voix m’inonde comment respirer a contre sens dans l’ambulance je te sens tout prêt  ta voix me réveille comme un goût de ciel sur ma peau je te suis  come raise me up wake me up take me to the light raise me up come raise me up wake me up take me to the light raise me up wake me up wake me up  reste près de moi retiens-moi, je respire encore reste là si je retombe, je retombe  come raise me up wake me up take me to the light raise me up come raise me up wake me up take me to the light raise me up wake me up wake me up"
avec le temps,louise attaque,aimer sur un seul pied sans savoir où poser ses lèvres ou ses pensées si seulement j’avais si seulement j’avais   aimer mais d’un seul trait avoir su proposer si seulement j’avais si seulement j’avais   avec le temps fort nécessaire avec les yeux sous la lumière avec les mains ça c’est les nerfs avec le temps fort nécessaire   avec le temps fort nécessaire avec les yeux sous la lumière avec les mains ça c’est les nerfs avec le temps fort nécessaire   aimer sur un seul pied sans savoir ou poser ses lèvres ou ses pensées si seulement j’avais   avec le temps fort nécessaire avec les yeux sous la lumière avec les mains ça c’est les nerfs avec le temps fort nécessaire   avec le temps fort nécessaire avec les yeux sous la lumière avec les mains ça c’est les nerfs avec le temps fort nécessaire   avec le temps fort nécessaire   avec le temps fort nécessaire avec les yeux sous la lumière avec les mains ça c’est les nerfs   avec le temps fort nécessaire avec les yeux sous la lumière avec les mains ça c’est les nerfs avec le temps fort nécessaire   avec le temps   avec le temps fort nécessaire avec le temps
les voisines,renan luce,"ai toujours préféré aux voisins les voisines dont les ombres chinoises ondulent sur les volets je me suis inventé un amour pantomime où glissent en or et noir tes bas sur tes mollets de ma fenêtre en face caresse le plexiglas maudis les techniciens dont les stores vénitiens découpent en tranches la moindre pervenche déshabillée ai toujours préféré aux voisins les voisines qui sèchent leurs dentelles au vent, sur les balcons est un peu toi qui danse quand danse la mousseline invitée au grand bal de tes slips en coton de ma fenêtre en face caresse le plexiglasjle maudis les méninges inventeurs du sèche-linge plus de lèche-vitrines à ces cache-poitrines que tu séchais ai toujours préféré aux voisins les voisines qui vident leurs armoires en quête une décision dans une heure environ tu choisiras le jean tu enfileras bien sûr dans mon champ de vision de ma fenêtre en face, caresse le plexiglas concurrence déloyale de ton chauffage central une buée dense interrompt ma transe puis des épais rideaux et est la goutte eau un ravalement façade me cache ta palissade une maison de retraite construite devant ma nêtre sur un fil par centaines sèchent immenses gaines ai toujours préféré aux voisins les voisines..."
encore un soir,céline dion,"une photo, une date est à y pas croire était pourtant hier, mentirait ma mémoire et ces visages enfants, et le mien dans ce miroir  oh, est pas pour me plaindre, ça vous avez rien à craindre la vie a tellement gâtée, ai plutôt du mal à éteindre ô mon dieu, ai eu ma part et bien plus à tant égards  mais quand on vit trop beau, trop fort, on en oublie le temps qui passe comme on perd un peu le nord au milieu de trop vastes espaces à peine le temps de y faire, à peine on doit laisser la place ô si je pouvais  encore un soir, encore une heure encore une larme de bonheur une faveur comme une fleur un souffle, une erreur un peu de nous, un rien de tout pour tout se dire encore ou bien se taire en regards, juste un report à peine encore, même il est tard  ai jamais rien demandé, ça est pas la mer à boire allez, face à éternité, ça va même pas se voir ça restera entre nous, ô juste un léger retard  en a tant qui tuent le temps tant et tant qui le perdent ou le passent tant qui se mentent inventent en les rêvant des instants de grâce ô je donne ma place au paradis si on oublie sur terre encore hier  encore un soir, encore une heure encore une larme de bonheur une faveur comme une fleur un souffle, une erreur un peu de nous, un rien de tout pour tout se dire encore ou bien se taire en regards, juste un report à peine encore, je sais, il est tard  est pas grand-chose, rien une pause que le temps, les horloges se reposent et caresser juste un baiser, un baiser  encore un soir, encore une heure un peu de nous, un rien de tout un soir"
un peu de rêve,vitaa,"comme on se couche on se lève regarde ce qu’ils nous ont fait ils veulent tirer sur nos rêves ils le font pour de vrai  le mal ne connait pas la trève le mal est dans l’excès les petits préparent la relève pendant qu’on cherche la paix ce monde n’a plus d’âme ce monde n’a plus d’âme  vendez-moi un peu de rêve j’ai plus le temps sauvez-moi, ici je crève j’ai plus le cran je veux déployer mes ailes m’envoler je suis tellement seule ça m’obsède je cherche la paix on fait semblant nos cœurs saignent on est tous les mêmes avant que la lumière s’éteigne j’ai tout à donner et vendez-moi un peu de rêve j’ai plus de cran je cherche la paix  je cherche la paix  les choix c’est marche ou crève on veut juste exister ils ont peur qu’on s’élèvent comme ça vous négliger et toutes nos séquelles que rien ne peut réparer dis-moi des pantins c’est lequel qui dit la vérité  ce monde n’a plus d’âme ce monde n’a plus d’âme  tendez-moi un peu de rêve j’ai plus le temps sauvez-moi, ici je crève j’ai plus le cran je veux déployer mes ailes m’envoler je suis tellement seule ça m’obsède je cherche la paix on fait semblant nos cœurs saignent on est tous les mêmes avant que la lumière s’éteigne j’ai tout à donner et vendez-moi un peu de rêve j’ai plus de cran je cherche la paix  ils veulent nous contrôler ils veulent nous faire taire je cherche la paix tout miser pour toucher nos rêves je cherche la paix  et qu’est-ce que ça peut faire si on veut quitter l’enfer tendre les ailes pour toucher nos rêves  tendez-moi un peu de rêve j’ai plus le temps sauvez-moi, ici je crève j’ai plus le cran je veux déployer mes ailes m’envoler je suis tellement seule ça m’obsède je cherche la paix on fait semblant nos cœurs saignent on est tous les mêmes avant que la lumière s’éteigne j’ai tout à donner et vendez-moi un peu de rêve j’ai plus de cran je cherche la paix  je cherche la paix, le bonheur quitter l’enfer, ici j’ai peur je cherche la paix, le bonheur non, non, non, non, non, non je cherche la paix, le bonheur quitter l’enfer, ici j’ai peur je cherche la paix, le bonheur non, non, non, non, non, non"
pourvu qu'elles soient douces,mylene farmer,"ton regard oblique en rien est lubrique ta maman a trop fessé ton goût du revers a rien de pervers et ton bébé est pas fâché  ton kamasutra a bien cent ans âge mon dieu que est démodé le nec plus ultra en ce paysage est aimer les deux cotés  ta majesté jamais ne te déplaces ! sans ton petit oreiller a jamais je suis ton unique classe tout est que prix à payer  tu fais des ah ! des oh ! derrière ton ouvrage quand mon petit pantalon debout et de dos sans perdre courage dénude tes obsessions  tu entêtes à te foutre de tout mais pourvu elles soient douces un poète tu as que la lune en tête des mes rondeurs tu es k.o. ! tu entêtes à te foutre de tout mais pourvu elles soient douces un esthète tu as gardé un ""air bête""... tout est beau si est ""vue de dos"" !  ok ! prose ou poésie tout est que prétexte pas la peine de excuser muse ou égérie mes petits fesses ne cessent de inspirer  je fais de ah ! des oh ! jamais ne me lasse par amour pour un toqué ne faut-il pas que jeunesse se passe a quoi bon se bousculer ?  tu entêtes à te foutre de tout mais pourvu elles soient douces un poète tu as que la lune en tête des mes rondeurs tu es k.o. ! tu entêtes à te foutre de tout mais pourvu elles soient douces un esthète tu as gardé un ""air bête"" tout est beau si est ""vue de dos"""
j'oublierai ton nom,johnny hallyday,"de semaines inutiles en futiles dimanches de secondes immobiles aux aiguilles qui penchent j’oublierai ton nom  de quatre nouveaux murs dans un autre quartier de pinceaux, de peinture en meubles à installer j’oublierai ton nom  de la piste suante à la dernière danse de quelques nuits de feu aux matinées de cendres de cette agitation dénuée de tout sens du fond de ma raison jusqu’à mon inconscience  de la main d’un ami au baiser d’une bouche tous ceux qui sauront lire que le mal a fait mouche j’oublierai ton nom  j’oublierai ton nom de mille façons et cette certitude me fait plus mal encore j’aimais cette blessure c’était toi encore  i know it’s been tough, i’ve hurt you enough but you’ll never see that i must be free forget my name  you’ll find someone, somewhere all your troubles to share she’ll wipe out the past, and feel at last forget my name all the good and the bad times we’ve ever had will seem so far away you’ll wonder why you were sad there’s hundreds of ways to kill away the time that’s how you are made you know you’ll never be mine  de la main d’un ami au baiser d’une bouche tous ceux qui sauront lire que le mal a fait mouche j’oublierai ton nom  j’oublierai ton nom de mille façons et cette certitude me fait plus mal encore j’aimais cette blessure c’était toi encore  j’oublierai ton nom de mille façons pour les mêmes raisons qui m’ont fait t’aimer parce qu’il fallait bien vivre avant d’oublier  j’oublierai ton nom de mille façons et cette certitude m’est la pire des morts j’aimais cette blessure c’était toi encore  j’oublierai ton nom"
un homme debout,claudio capéo,"si je endors, me réveillerez-vous ? il fait si froid dehors, le ressentez-vous ? il fut un temps où étais comme vous malgré toutes mes galères, je reste un homme debout  priez pour que je en sorte priez pour que mieux je me porte ne me jetez pas la faute ne me fermez pas la porte  oui je vis, de jour en jour de squat en squat, un troubadour si je chante, est pour on regarde, ne serait-ce un tit bonjour vous vois passer, quand suis assis vous êtes debout, pressés, apprécie un tit regard, un tit sourire peu prennent le temps, ils ne font que courir  si je endors, me réveillerez-vous ? il fait si froid dehors, le ressentez-vous ? il fut un temps où étais comme vous malgré toutes mes galères, je reste un homme debout  la la la la la la la la la la la la la la la  merci bien pour la pièce en moment est dur, je confesse fin vais en sortir je atteste un jour avoir un toit, une adresse même si de toi à moi est dur, je stresse  le moral est pas toujours bon, le temps presse mais bon comment faire, à part ivresse comme futur et des promesses, en veux-tu ?  voilà ma vie, me suis pris des coups dans la tronche sois sûr que si tombe par terre tout monde passe mais personne ne bronche franchement à part les gosses qui regardent étrangement tout monde trouve ça normal que fasse la manche en veuillez pas, mais parfois, ai une envie abandonner  si je endors me réveillerez-vous ? il fait si froid dehors le ressentez-vous ? il fut un temps où étais comme vous malgré toutes mes galères je reste un homme debout  priez pour que je en sorte priez pour que mieux je me porte ne me jetez pas la faute ne me ferme pas la porte  si je endors me réveillerez-vous ? il fait si froid dehors le ressentez-vous ? il fut un temps où étais comme vous malgré toutes mes galères je reste un homme debout  si je endors me réveillerez-vous ? il fait si froid dehors le ressentez-vous ? il fut un temps où étais comme vous malgré toutes mes galères je reste un homme debout  la la la la la la la la la la la la la la la la la la la la la la la la la la la la la la la la la la la la la la la la  la la la la la la la la la la la la la la la  la la la la la la la la la la la la la la la"
je fais de toi mon essentiel,emmanuel moire,"je sais ton amour je sais eau versée sur mon corps sentir son cours jour après jour ai remonté les tourments pour approcher encore ai ton désir ancré sur le mien ai ton désir ancré à mes chevilles viens, rien ne nous retient à rien tout ne tient à nous  je fais de toi mon essentiel tu me fais naître parmi les hommes je fais de toi mon essentiel celle que aimerai plus que personne si tu veux on apprenne si tu veux on apprenne  tu sais mon amour tu sais les mots sous mes silences ce ils avouent, couvrent et découvrent ai à offrir des croyances pour conjurer absence ai avenir gravé dans ta main ai avenir tracé comme tu écris tiens, rien ne nous emmène plus loin un geste qui revient  je fais de toi mon essentiel tu me fais naître parmi les hommes je fais de toi mon essentiel celle que aimerais plus que personne si tu veux on apprenne si tu veux on apprenne si tu veux on apprenne...  je ferai de toi mon essentiel mon essentiel si tu veux on apprenne on appartienne"
